{
    "name": "1st Chertsey",
    "location": "Staines Ln, KT16 8PS",
    "mapLink": "https://maps.app.goo.gl/buqViwWCRUkCaze7A",
    "image": "./Image.png",
    "contact":"https://1stchertseyscoutgroup.com/get-in-touch/",
    "facebook":"https://www.facebook.com/1stchertseyscoutgroup",
    "website": "https://1stchertseyscoutgroup.com/"
}