{
    "name": "1st/4th Addlestone",
    "location": "Spinney Hill, KT15 1AD",
    "mapLink": "https://maps.app.goo.gl/LF539JkFheDHnL6N6",
    "image": "./Image.png",
    "contact":"http://www.1st4th.org.uk/#contact-form-block-template-canvas",
    "facebook":"",
    "website": "http://www.1st4th.org.uk/"
}